K6/lms/results/01-learning-progress-before-500-summary.json

{
  "root_group": {
    "id": "d41d8cd98f00b204e9800998ecf8427e",
    "groups": [
      {
        "path": "::setup",
        "id": "5c0f8025f7e0b6654089e5b00e950f1a",
        "groups": [],
        "checks": [
            {
              "passes": 1,
              "fails": 0,
              "name": "login setup: status is 200",
              "path": "::setup::login setup: status is 200",
              "id": "c6766d29c7b3ddd36cb173458da5385c"
            },
            {
              "name": "login setup: has accessToken cookie",
              "path": "::setup::login setup: has accessToken cookie",
              "id": "e3cf973644e1e564ab3f0571653fdaa7",
              "passes": 1,
              "fails": 0
            }
          ],
        "name": "setup"
      }
    ],
    "checks": [
      {
        "passes": 20032,
        "fails": 0,
        "name": "progress update: status is 200",
        "path": "::progress update: status is 200",
        "id": "23da4bfb46ca9594dff4865e3bc6942e"
      },
      {
        "name": "progress update: response has success envelope",
        "path": "::progress update: response has success envelope",
        "id": "5e1ad1d7d3ac5595a091ae429e534198",
        "passes": 20032,
        "fails": 0
      }
    ],
    "name": "",
    "path": ""
  },
  "options": {
    "noColor": false,
    "summaryTrendStats": [
      "avg",
      "min",
      "med",
      "max",
      "p(90)",
      "p(95)",
      "p(99)"
    ],
    "summaryTimeUnit": ""
  },
  "state": {
    "testRunDurationMs": 102213.4486,
    "isStdOutTTY": true,
    "isStdErrTTY": true
  },
  "metrics": {
    "http_req_tls_handshaking": {
      "type": "trend",
      "contains": "time",
      "values": {
        "avg": 0,
        "min": 0,
        "med": 0,
        "max": 0,
        "p(90)": 0,
        "p(95)": 0,
        "p(99)": 0
      }
    },
    "http_req_duration{type:lms_progress_update}": {
      "values": {
        "p(90)": 28.66113,
        "p(95)": 30.954415000000008,
        "p(99)": 39.48048399999993,
        "avg": 24.929032013777753,
        "min": 12.3518,
        "med": 24.47625,
        "max": 98.3551
      },
      "thresholds": {
        "p(95)<1000": {
          "ok": true
        }
      },
      "type": "trend",
      "contains": "time"
    },
    "http_req_waiting": {
      "type": "trend",
      "contains": "time",
      "values": {
        "max": 85.7629,
        "p(90)": 28.32826,
        "p(95)": 30.612439999999996,
        "p(99)": 39.118544,
        "avg": 24.60979661059225,
        "min": 12.1248,
        "med": 24.1744
      }
    },
    "checks": {
      "type": "rate",
      "contains": "default",
      "values": {
        "rate": 1,
        "passes": 40066,
        "fails": 0
      }
    },
    "http_req_sending": {
      "type": "trend",
      "contains": "time",
      "values": {
        "avg": 0.00679896171317327,
        "min": 0,
        "med": 0,
        "max": 2.0125,
        "p(90)": 0,
        "p(95)": 0,
        "p(99)": 0.5096
      }
    },
    "data_sent": {
      "type": "counter",
      "contains": "data",
      "values": {
        "count": 8406960,
        "rate": 82249.05934736262
      }
    },
    "http_req_connecting": {
      "values": {
        "avg": 0.017051829481355783,
        "min": 0,
        "med": 0,
        "max": 2.6664,
        "p(90)": 0,
        "p(95)": 0,
        "p(99)": 0.5812880000000005
      },
      "type": "trend",
      "contains": "time"
    },
    "vus_max": {
      "type": "gauge",
      "contains": "default",
      "values": {
        "value": 500,
        "min": 500,
        "max": 500
      }
    },
    "iterations": {
      "type": "counter",
      "contains": "default",
      "values": {
        "count": 20032,
        "rate": 195.9820383166291
      }
    },
    "vus": {
      "type": "gauge",
      "contains": "default",
      "values": {
        "value": 1,
        "min": 1,
        "max": 500
      }
    },
    "data_received": {
      "type": "counter",
      "contains": "data",
      "values": {
        "count": 40900491,
        "rate": 400147.8431674792
      }
    },
    "http_req_receiving": {
      "contains": "time",
      "values": {
        "avg": 0.31468390156241977,
        "min": 0,
        "med": 0.4536,
        "max": 18.714,
        "p(90)": 0.6039,
        "p(95)": 0.7617999999999989,
        "p(99)": 1.1723160000000004
      },
      "type": "trend"
    },
    "http_reqs": {
      "values": {
        "count": 20033,
        "rate": 195.99182176502748
      },
      "type": "counter",
      "contains": "default"
    },
    "http_req_failed": {
      "type": "rate",
      "contains": "default",
      "values": {
        "rate": 0,
        "passes": 0,
        "fails": 20033
      },
      "thresholds": {
        "rate<0.01": {
          "ok": true
        }
      }
    },
    "iteration_duration": {
      "values": {
        "min": 1019.0585,
        "med": 2029.817,
        "max": 3067.3179,
        "p(90)": 2822.06983,
        "p(95)": 2929.0934,
        "p(99)": 3005.7024309999997,
        "avg": 2024.8847612819516
      },
      "type": "trend",
      "contains": "time"
    },
    "http_req_duration": {
      "contains": "time",
      "values": {
        "avg": 24.931279473867914,
        "min": 12.3518,
        "med": 24.4763,
        "max": 98.3551,
        "p(90)": 28.66208,
        "p(95)": 30.960279999999994,
        "p(99)": 39.51960800000001
      },
      "type": "trend"
    },
    "http_req_duration{expected_response:true}": {
      "type": "trend",
      "contains": "time",
      "values": {
        "p(99)": 39.51960800000001,
        "avg": 24.931279473867914,
        "min": 12.3518,
        "med": 24.4763,
        "max": 98.3551,
        "p(90)": 28.66208,
        "p(95)": 30.960279999999994
      }
    },
    "http_req_blocked": {
      "type": "trend",
      "contains": "time",
      "values": {
        "avg": 0.01951401188039736,
        "min": 0,
        "med": 0,
        "max": 3.1386,
        "p(90)": 0,
        "p(95)": 0,
        "p(99)": 0.7140840000000062
      }
    }
  },
  "setup_data": {
    "cookieHeader": "accessToken=eyJhbGciOiJIUzM4NCJ9.eyJzdWIiOiJiYWVrMTg4NUBuYXZlci5jb20iLCJ0eXBlIjoiVVNFUiIsImlhdCI6MTc4MjcwNDMyOCwiZXhwIjoxNzgyNzA2MTI4fQ.KKLtgl5rF8Kqt07_jRkvX8pMXBQPuyBMeeKMAEMkycSuE43k4Og9PfcPcpq8J4ce"
  }
}

K6/lms/results/01-learning-progress-before-500-summary.md

# Load Test Report: 01-learning-progress-load-test

checks...........................: 100.00% ✓ 40066      ✗ 0    
     data_received....................: 41 MB   400 kB/s
     data_sent........................: 8.4 MB  82 kB/s
     http_req_blocked.................: avg=19.51µs  min=0s      med=0s      max=3.13ms  p(90)=0s      p(95)=0s       p(99)=714.08µs
     http_req_connecting..............: avg=17.05µs  min=0s      med=0s      max=2.66ms  p(90)=0s      p(95)=0s       p(99)=581.28µs
     http_req_duration................: avg=24.93ms  min=12.35ms med=24.47ms max=98.35ms p(90)=28.66ms p(95)=30.96ms  p(99)=39.51ms 
       { expected_response:true }.....: avg=24.93ms  min=12.35ms med=24.47ms max=98.35ms p(90)=28.66ms p(95)=30.96ms  p(99)=39.51ms 
     ✓ { type:lms_progress_update }...: avg=24.92ms  min=12.35ms med=24.47ms max=98.35ms p(90)=28.66ms p(95)=30.95ms  p(99)=39.48ms 
   ✓ http_req_failed..................: 0.00%   ✓ 0          ✗ 20033
     http_req_receiving...............: avg=314.68µs min=0s      med=453.6µs max=18.71ms p(90)=603.9µs p(95)=761.79µs p(99)=1.17ms  
     http_req_sending.................: avg=6.79µs   min=0s      med=0s      max=2.01ms  p(90)=0s      p(95)=0s       p(99)=509.6µs 
     http_req_tls_handshaking.........: avg=0s       min=0s      med=0s      max=0s      p(90)=0s      p(95)=0s       p(99)=0s      
     http_req_waiting.................: avg=24.6ms   min=12.12ms med=24.17ms max=85.76ms p(90)=28.32ms p(95)=30.61ms  p(99)=39.11ms 
     http_reqs........................: 20033   195.991822/s
     iteration_duration...............: avg=2.02s    min=1.01s   med=2.02s   max=3.06s   p(90)=2.82s   p(95)=2.92s    p(99)=3s      
     iterations.......................: 20032   195.982038/s
     vus..............................: 1       min=1        max=500
     vus_max..........................: 500     min=500      max=500