K6/lms/results/03-my-course-list-after-summary.json

{
  "root_group": {
    "name": "",
    "path": "",
    "id": "d41d8cd98f00b204e9800998ecf8427e",
    "groups": [
      {
        "name": "setup",
        "path": "::setup",
        "id": "5c0f8025f7e0b6654089e5b00e950f1a",
        "groups": [],
        "checks": [
            {
              "name": "login setup: status is 200",
              "path": "::setup::login setup: status is 200",
              "id": "c6766d29c7b3ddd36cb173458da5385c",
              "passes": 1,
              "fails": 0
            },
            {
              "name": "login setup: has accessToken cookie",
              "path": "::setup::login setup: has accessToken cookie",
              "id": "e3cf973644e1e564ab3f0571653fdaa7",
              "passes": 1,
              "fails": 0
            }
          ]
      }
    ],
    "checks": [
      {
        "name": "my course list: status is 200",
        "path": "::my course list: status is 200",
        "id": "8e2222c491f08b935de9082311b6fcff",
        "passes": 39975,
        "fails": 0
      },
      {
        "name": "my course list: response has success envelope",
        "path": "::my course list: response has success envelope",
        "id": "5add27dc3e06cb7e54035c9c27ba434f",
        "passes": 39975,
        "fails": 0
      }
    ]
  },
  "options": {
    "summaryTrendStats": [
      "avg",
      "min",
      "med",
      "max",
      "p(90)",
      "p(95)",
      "p(99)"
    ],
    "summaryTimeUnit": "",
    "noColor": false
  },
  "state": {
    "isStdOutTTY": true,
    "isStdErrTTY": true,
    "testRunDurationMs": 102641.3004
  },
  "metrics": {
    "http_reqs": {
      "type": "counter",
      "contains": "default",
      "values": {
        "count": 39976,
        "rate": 389.4728520021751
      }
    },
    "vus": {
      "type": "gauge",
      "contains": "default",
      "values": {
        "min": 5,
        "max": 1000,
        "value": 5
      }
    },
    "iterations": {
      "type": "counter",
      "contains": "default",
      "values": {
        "count": 39975,
        "rate": 389.4631093352749
      }
    },
    "http_req_duration{expected_response:true}": {
      "values": {
        "avg": 23.08407216579931,
        "min": 8.8733,
        "med": 18.13485,
        "max": 715.4379,
        "p(90)": 24.51545,
        "p(95)": 31.06505,
        "p(99)": 229.099575
      },
      "type": "trend",
      "contains": "time"
    },
    "http_req_receiving": {
      "contains": "time",
      "values": {
        "avg": 0.31992564038422916,
        "min": 0,
        "med": 0.5064,
        "max": 10.5135,
        "p(90)": 0.60605,
        "p(95)": 0.7502249999999999,
        "p(99)": 1.4941
      },
      "type": "trend"
    },
    "http_req_failed": {
      "contains": "default",
      "values": {
        "rate": 0,
        "passes": 0,
        "fails": 39976
      },
      "thresholds": {
        "rate<0.01": {
          "ok": true
        }
      },
      "type": "rate"
    },
    "checks": {
      "type": "rate",
      "contains": "default",
      "values": {
        "rate": 1,
        "passes": 79952,
        "fails": 0
      }
    },
    "vus_max": {
      "type": "gauge",
      "contains": "default",
      "values": {
        "value": 1000,
        "min": 1000,
        "max": 1000
      }
    },
    "iteration_duration": {
      "type": "trend",
      "contains": "time",
      "values": {
        "avg": 2028.5101777485938,
        "min": 1013.6571,
        "med": 2030.3053,
        "max": 3414.4022,
        "p(90)": 2824.90166,
        "p(95)": 2923.6401499999997,
        "p(99)": 3004.053928
      }
    },
    "http_req_tls_handshaking": {
      "type": "trend",
      "contains": "time",
      "values": {
        "min": 0,
        "med": 0,
        "max": 0,
        "p(90)": 0,
        "p(95)": 0,
        "p(99)": 0,
        "avg": 0
      }
    },
    "http_req_duration": {
      "type": "trend",
      "contains": "time",
      "values": {
        "p(90)": 24.51545,
        "p(95)": 31.06505,
        "p(99)": 229.099575,
        "avg": 23.08407216579931,
        "min": 8.8733,
        "med": 18.13485,
        "max": 715.4379
      }
    },
    "http_req_blocked": {
      "type": "trend",
      "contains": "time",
      "values": {
        "p(99)": 1.044625,
        "avg": 0.022837049729837907,
        "min": 0,
        "med": 0,
        "max": 11.8543,
        "p(90)": 0,
        "p(95)": 0
      }
    },
    "http_req_connecting": {
      "type": "trend",
      "contains": "time",
      "values": {
        "med": 0,
        "max": 4.2371,
        "p(90)": 0,
        "p(95)": 0,
        "p(99)": 0.774625,
        "avg": 0.01880102061236743,
        "min": 0
      }
    },
    "http_req_sending": {
      "type": "trend",
      "contains": "time",
      "values": {
        "max": 4.0089,
        "p(90)": 0,
        "p(95)": 0,
        "p(99)": 0.529925,
        "avg": 0.010534175505303178,
        "min": 0,
        "med": 0
      }
    },
    "data_sent": {
      "type": "counter",
      "contains": "data",
      "values": {
        "count": 13551708,
        "rate": 132029.77697270093
      }
    },
    "http_req_waiting": {
      "values": {
        "p(99)": 228.501575,
        "avg": 22.75361234990999,
        "min": 8.7654,
        "med": 17.8106,
        "max": 714.9312,
        "p(90)": 24.1126,
        "p(95)": 30.614375000000003
      },
      "type": "trend",
      "contains": "time"
    },
    "data_received": {
      "type": "counter",
      "contains": "data",
      "values": {
        "count": 129748306,
        "rate": 1264094.5262225068
      }
    },
    "http_req_duration{type:lms_my_course_list}": {
      "values": {
        "med": 18.1348,
        "max": 715.4379,
        "p(90)": 24.513979999999997,
        "p(95)": 31.051869999999937,
        "p(99)": 229.11668600000348,
        "avg": 23.0828146391493,
        "min": 8.8733
      },
      "thresholds": {
        "p(95)<1000": {
          "ok": true
        }
      },
      "type": "trend",
      "contains": "time"
    }
  },
  "setup_data": {
    "cookieHeader": "accessToken=eyJhbGciOiJIUzM4NCJ9.eyJzdWIiOiJiYWVrMTg4NUBuYXZlci5jb20iLCJ0eXBlIjoiVVNFUiIsImlhdCI6MTc4MjcyMDM1MSwiZXhwIjoxNzgyNzIyMTUxfQ.t6ERArJcHMQaapUmHiXDj7iaN94bpZ7fIxc6N94QUVJ6Izi9sng0ZYfSREc2ptAg"
  }
}

K6/lms/results/03-my-course-list-after-summary.md

# Load Test Report: 03-my-course-list-load-test

checks..........................: 100.00% ✓ 79952      ✗ 0     
     data_received...................: 130 MB  1.3 MB/s
     data_sent.......................: 14 MB   132 kB/s
     http_req_blocked................: avg=22.83µs  min=0s     med=0s      max=11.85ms  p(90)=0s       p(95)=0s       p(99)=1.04ms  
     http_req_connecting.............: avg=18.8µs   min=0s     med=0s      max=4.23ms   p(90)=0s       p(95)=0s       p(99)=774.62µs
     http_req_duration...............: avg=23.08ms  min=8.87ms med=18.13ms max=715.43ms p(90)=24.51ms  p(95)=31.06ms  p(99)=229.09ms
       { expected_response:true }....: avg=23.08ms  min=8.87ms med=18.13ms max=715.43ms p(90)=24.51ms  p(95)=31.06ms  p(99)=229.09ms
     ✓ { type:lms_my_course_list }...: avg=23.08ms  min=8.87ms med=18.13ms max=715.43ms p(90)=24.51ms  p(95)=31.05ms  p(99)=229.11ms
   ✓ http_req_failed.................: 0.00%   ✓ 0          ✗ 39976 
     http_req_receiving..............: avg=319.92µs min=0s     med=506.4µs max=10.51ms  p(90)=606.04µs p(95)=750.22µs p(99)=1.49ms  
     http_req_sending................: avg=10.53µs  min=0s     med=0s      max=4ms      p(90)=0s       p(95)=0s       p(99)=529.92µs
     http_req_tls_handshaking........: avg=0s       min=0s     med=0s      max=0s       p(90)=0s       p(95)=0s       p(99)=0s      
     http_req_waiting................: avg=22.75ms  min=8.76ms med=17.81ms max=714.93ms p(90)=24.11ms  p(95)=30.61ms  p(99)=228.5ms 
     http_reqs.......................: 39976   389.472852/s
     iteration_duration..............: avg=2.02s    min=1.01s  med=2.03s   max=3.41s    p(90)=2.82s    p(95)=2.92s    p(99)=3s      
     iterations......................: 39975   389.463109/s
     vus.............................: 5       min=5        max=1000
     vus_max.........................: 1000    min=1000     max=1000